<?xml version="1.0" encoding="UTF-8"?>
<Transliteration xmlns:xsi="http://www.w3.org/2001/XMLSchema-instance" xsi:noNamespaceSchemaLocation="Transliteration.xsd" title="ГОСТ 7.79-2000">
	<element from="а" to="a"/>
	<element from="А" to="A"/>
	<element from="б" to="b"/>
	<element from="Б" to="B"/>
	<element from="в" to="v"/>
	<element from="В" to="V"/>
	<element from="г" to="g"/>
	<element from="Г" to="G"/>
	<element from="д" to="d"/>
	<element from="Д" to="D"/>
	<element from="е" to="e"/>
	<element from="Е" to="E"/>
	<element from="ё" to="jo"/>
	<element from="Ё" to="Jo"/>
	<element from="ж" to="zh"/>
	<element from="Ж" to="Zh"/>
	<element from="з" to="z"/>
	<element from="З" to="Z"/>
	<element from="и" to="i"/>
	<element from="И" to="I"/>
	<element from="й" to="jj"/>
	<element from="Й" to="Jj"/>
	<element from="к" to="k"/>
	<element from="К" to="K"/>
	<element from="л" to="l"/>
	<element from="Л" to="L"/>
	<element from="м" to="m"/>
	<element from="М" to="M"/>
	<element from="н" to="n"/>
	<element from="Н" to="N"/>
	<element from="о" to="o"/>
	<element from="О" to="O"/>
	<element from="п" to="p"/>
	<element from="П" to="P"/>
	<element from="р" to="r"/>
	<element from="Р" to="R"/>
	<element from="с" to="s"/>
	<element from="С" to="S"/>
	<element from="т" to="t"/>
	<element from="Т" to="T"/>
	<element from="у" to="u"/>
	<element from="У" to="U"/>
	<element from="ф" to="f"/>
	<element from="Ф" to="F"/>
	<element from="х" to="kh"/>
	<element from="Х" to="Kh"/>
	<element from="ц" to="c"/>
	<element from="Ц" to="C"/>
	<element from="ч" to="ch"/>
	<element from="Ч" to="Ch"/>
	<element from="ш" to="sh"/>
	<element from="Ш" to="Sh"/>
	<element from="щ" to="shh"/>
	<element from="Щ" to="Shh"/>
	<element from="ь" to="'"/>
	<element from="Ь" to="'"/>
	<element from="ы" to="y"/>
	<element from="Ы" to="Y"/>
	<element from="ъ" to="&quot;"/>
	<element from="Ъ" to="&quot;"/>
	<element from="э" to="eh"/>
	<element from="Э" to="Eh"/>
	<element from="ю" to="ju"/>
	<element from="Ю" to="Ju"/>
	<element from="я" to="ja"/>
	<element from="Я" to="Ja"/>
</Transliteration>
