<?xml version="1.0" encoding="UTF-8"?>
<Transliteration xmlns:xsi="http://www.w3.org/2001/XMLSchema-instance" xsi:noNamespaceSchemaLocation="Transliteration.xsd" title="Глаголица">
	<element from="а" to="Аз"/>
	<element from="А" to="АЗ"/>
	<element from="б" to="Буки"/>
	<element from="Б" to="БУКИ"/>
	<element from="в" to="Веди"/>
	<element from="В" to="ВЕДИ"/>
	<element from="г" to="Глагол"/>
	<element from="Г" to="ГЛАГОЛ"/>
	<element from="д" to="Добро"/>
	<element from="Д" to="ДОБРО"/>
	<element from="е" to="Еси"/>
	<element from="Е" to="ЕСИ"/>
	<element from="ё" to="Он'"/>
	<element from="Ё" to="ОН'"/>
	<element from="ж" to="Живите"/>
	<element from="Ж" to="ЖИВИТЕ"/>
	<element from="з" to="Земля"/>
	<element from="З" to="ЗЕМЛЯ"/>
	<element from="и" to="и"/>
	<element from="И" to="И"/>
	<element from="й" to="Иже"/>
	<element from="Й" to="ИЖЕ"/>
	<element from="к" to="Како"/>
	<element from="К" to="КАКО"/>
	<element from="л" to="Люди"/>
	<element from="Л" to="ЛЮДИ"/>
	<element from="м" to="Мыслите"/>
	<element from="М" to="МЫСЛИТЕ"/>
	<element from="н" to="Наш"/>
	<element from="Н" to="НАШ"/>
	<element from="о" to="Он"/>
	<element from="О" to="ОН"/>
	<element from="п" to="Покой"/>
	<element from="П" to="ПОКОЙ"/>
	<element from="р" to="Рцы"/>
	<element from="Р" to="РЦЫ"/>
	<element from="с" to="Слово"/>
	<element from="С" to="СЛОВО"/>
	<element from="т" to="Твердо"/>
	<element from="Т" to="ТВЕРДО"/>
	<element from="у" to="Ук"/>
	<element from="У" to="УК"/>
	<element from="ф" to="Ферт"/>
	<element from="Ф" to="ФЕРТ"/>
	<element from="х" to="Херъ"/>
	<element from="Х" to="ХЕРЪ"/>
	<element from="ц" to="Ци"/>
	<element from="Ц" to="ЦИ"/>
	<element from="ч" to="Червь"/>
	<element from="Ч" to="ЧЕРВЬ"/>
	<element from="ш" to="Ша"/>
	<element from="Ш" to="ША"/>
	<element from="щ" to="Шта"/>
	<element from="Щ" to="ШТА"/>
	<element from="ь" to="Ер"/>
	<element from="Ь" to="ЕР"/>
	<element from="ы" to="Еры"/>
	<element from="Ы" to="ЕРЫ"/>
	<element from="ъ" to="Ерь"/>
	<element from="Ъ" to="ЕРЬ"/>
	<element from="э" to="Еси'"/>
	<element from="Э" to="ЕСИ'"/>
	<element from="ю" to="Ук'"/>
	<element from="Ю" to="УК'"/>
	<element from="я" to="Аз'"/>
	<element from="Я" to="АЗ'"/>
</Transliteration>
